{
  "kind": "selfhelp-mobile-preview-release",
  "id": "selfhelp-mobile-preview-0.1.33",
  "version": "0.1.33",
  "channel": "stable",
  "releasedAt": "2026-07-10T14:47:43.775Z",
  "image": "ghcr.io/humdek-unibe-ch/selfhelp-mobile-preview:0.1.33",
  "digest": "sha256:7cafe6deb47675c975f4853d0d328727e38e68dda9df587e903175de51afb07b",
  "builtFrom": {
    "expoWebExport": true,
    "sharedPackageVersion": "1.21.7",
    "expoSdk": "~55.0.23",
    "reactNative": "0.83.6"
  },
  "backendCompatibility": {
    "requiredCoreRange": ">=0.1.36 <0.2.0",
    "requiredApiVersion": "0.1.0"
  },
  "mobileRendererVersion": "0.3.0",
  "reactNativeVersion": "0.83.6",
  "expoSdkVersion": "55.0.23",
  "bundledPlugins": [
    {
      "id": "sh2-shp-survey-js",
      "version": "0.3.3",
      "mobilePackage": "@selfhelp/sh2-shp-survey-js-mobile",
      "mobilePackageVersion": "0.3.3"
    }
  ],
  "security": {
    "signature": "+/ET8nM42VHRzcV5FCmn0sPcJQOWO+bepKHQomoeShuC9yWXBA8jf2YEbbdtQRV2KKo/YPrdl61+psUb5Z3nDA==",
    "keyId": "prod",
    "signedPayloadSha256": "sha256:2d23ee18b212fe14b1e96edd13357496c3408c0d1141625f071b11d49a35f5d6"
  }
}
